{
  "schema": "bvst.sample-source/v1",
  "name": "bvst.sample.samplerlab.sine220.source-manifest.v1",
  "sample_id": "samplerlab-sine220",
  "release_scope": "sampler-wave-experimental",
  "plugin_targets": [
    "SamplerLab"
  ],
  "audio_leaf": {
    "name": "bvst.sample.samplerlab.sine220.audio.v1",
    "token_id": null,
    "txid": null,
    "block_height": null,
    "path": "sampler-wave/assets/audio/samplerlab.sine220.audio.wav",
    "mime_type": "audio/wav",
    "sha256": "874fba51133a73b99d436d5d1743a4f03dab9887fd636813d5e5882a777ece4a",
    "bytes": 15478,
    "chunks": 1,
    "route": "helper"
  },
  "playback": {
    "root_note": 57,
    "loop_start_pct": 0.05,
    "loop_end_pct": 0.95,
    "one_shot": false,
    "channels": 1,
    "sample_rate": 22050,
    "duration_seconds": 0.35
  },
  "runtime_source": {
    "id": "sine220",
    "label": "Sine 220",
    "content_url": null,
    "content_url_template": "/content/{txid}"
  }
}
